{
  "capture_id": "do009-capture",
  "completion_state": "complete",
  "ended_at": "2026-08-12T10:00:02Z",
  "events": [
    {
      "capture_time_ns": 0,
      "channel": 0,
      "controller": null,
      "controller_value": null,
      "event_id": "raw-0-on",
      "event_type": "note_on",
      "note": 60,
      "pitch_bend": null,
      "raw_payload": [],
      "schema_version": "1.0.0",
      "sequence_number": 0,
      "source_device": "deterministic-fake",
      "source_port": "fake",
      "source_string": null,
      "velocity": 90
    },
    {
      "capture_time_ns": 250000000,
      "channel": 0,
      "controller": null,
      "controller_value": null,
      "event_id": "raw-0-off",
      "event_type": "note_off",
      "note": 60,
      "pitch_bend": null,
      "raw_payload": [],
      "schema_version": "1.0.0",
      "sequence_number": 1,
      "source_device": "deterministic-fake",
      "source_port": "fake",
      "source_string": null,
      "velocity": 0
    },
    {
      "capture_time_ns": 500000000,
      "channel": 0,
      "controller": null,
      "controller_value": null,
      "event_id": "raw-1-on",
      "event_type": "note_on",
      "note": 63,
      "pitch_bend": null,
      "raw_payload": [],
      "schema_version": "1.0.0",
      "sequence_number": 2,
      "source_device": "deterministic-fake",
      "source_port": "fake",
      "source_string": null,
      "velocity": 90
    },
    {
      "capture_time_ns": 750000000,
      "channel": 0,
      "controller": null,
      "controller_value": null,
      "event_id": "raw-1-off",
      "event_type": "note_off",
      "note": 63,
      "pitch_bend": null,
      "raw_payload": [],
      "schema_version": "1.0.0",
      "sequence_number": 3,
      "source_device": "deterministic-fake",
      "source_port": "fake",
      "source_string": null,
      "velocity": 0
    },
    {
      "capture_time_ns": 1000000000,
      "channel": 0,
      "controller": null,
      "controller_value": null,
      "event_id": "raw-2-on",
      "event_type": "note_on",
      "note": 67,
      "pitch_bend": null,
      "raw_payload": [],
      "schema_version": "1.0.0",
      "sequence_number": 4,
      "source_device": "deterministic-fake",
      "source_port": "fake",
      "source_string": null,
      "velocity": 90
    },
    {
      "capture_time_ns": 1250000000,
      "channel": 0,
      "controller": null,
      "controller_value": null,
      "event_id": "raw-2-off",
      "event_type": "note_off",
      "note": 67,
      "pitch_bend": null,
      "raw_payload": [],
      "schema_version": "1.0.0",
      "sequence_number": 5,
      "source_device": "deterministic-fake",
      "source_port": "fake",
      "source_string": null,
      "velocity": 0
    }
  ],
  "faults": [],
  "meter_context": {
    "beat_unit": 4,
    "beats_per_bar": 4,
    "schema_version": "1.0.0"
  },
  "provenance": {},
  "runtime_identity": {
    "reported_version": "1",
    "runtime_id": "fake",
    "runtime_kind": "fake",
    "schema_version": "1.0.0",
    "version_policy": "test",
    "version_supported": true
  },
  "schema_version": "1.0.0",
  "session_id": "do009-session",
  "source_identity": {
    "device": "deterministic-fake",
    "port": "fake",
    "schema_version": "1.0.0",
    "source_id": "fake",
    "supplies_string_identity": false
  },
  "started_at": "2026-08-12T10:00:00Z",
  "tempo_context": 120,
  "warnings": []
}
